{
  "schemaVersion": 1,
  "generatedAt": "2026-01-18T20:35:59.056Z",
  "book": {
    "id": 99025,
    "title": "The Shadow",
    "authors": [
      "Unknown"
    ],
    "characters": [
      "Learned Man",
      "Shadow"
    ],
    "keywords": [
      "Andersen",
      "doppelganger",
      "identity",
      "darkness",
      "philosophy",
      "tragic"
    ],
    "description": "A man's shadow takes on a life of its own with sinister consequences.",
    "languages": [
      "en"
    ],
    "subjects": [],
    "downloadCount": 0,
    "updatedAt": null,
    "links": {
      "txtUrl": null,
      "epubUrl": null,
      "coverUrl": null
    },
    "estimate": null,
    "source": {
      "kind": "local",
      "externalId": null
    }
  },
  "local": {
    "layout": "by-title",
    "folderName": "The Shadow",
    "relativeDir": ".data/texts/by-title/The Shadow",
    "files": [
      {
        "role": "full",
        "filename": "full.txt",
        "bytes": 3241,
        "sha256": "f091e9240c092d6f2811fd4a82013628bc1481366a178fc59be8c140a0f5c0a0"
      },
      {
        "role": "bedtime",
        "filename": "bedtime.txt",
        "bytes": 2632,
        "sha256": "380cf8f6fc9fabdbe9171556ac38b224dfad55372408c987a5254cdcccfe94d2"
      }
    ]
  }
}
