{
  "schemaVersion": 1,
  "generatedAt": "2026-01-18T20:35:59.030Z",
  "book": {
    "id": 99020,
    "title": "The Little Match Girl",
    "authors": [
      "Unknown"
    ],
    "characters": [
      "Little Match Girl",
      "Grandmother"
    ],
    "keywords": [
      "Andersen",
      "poverty",
      "cold",
      "New Year's Eve",
      "visions",
      "tragedy",
      "matches"
    ],
    "description": "A poor girl lights matches on a freezing night, each flame bringing beautiful visions.",
    "languages": [
      "en"
    ],
    "subjects": [],
    "downloadCount": 0,
    "updatedAt": null,
    "links": {
      "txtUrl": null,
      "epubUrl": null,
      "coverUrl": null
    },
    "estimate": null,
    "source": {
      "kind": "local",
      "externalId": null
    }
  },
  "local": {
    "layout": "by-title",
    "folderName": "The Little Match Girl",
    "relativeDir": ".data/texts/by-title/The Little Match Girl",
    "files": [
      {
        "role": "full",
        "filename": "full.txt",
        "bytes": 3277,
        "sha256": "9bd3bf9da85399a68c0cded425b01ef22e5d9e7493ec217a26be1f9bc68706c3"
      },
      {
        "role": "bedtime",
        "filename": "bedtime.txt",
        "bytes": 2488,
        "sha256": "a8729282c7dd4cb2df54a270e40856ad15cf0a8b7bd19384e610b61ecdc94078"
      },
      {
        "role": "audio",
        "filename": "The_Little_Match_Girl.mp3",
        "bytes": 2666934,
        "sha256": "ff56b26f16ffc1662ea8051278c52ba6a59ed5f77f99b902af20549ac7d3d76e"
      },
      {
        "role": "image",
        "filename": "The_Little_Match_Girl.png",
        "bytes": 2916618,
        "sha256": "374a0c34d644a9ae612ec474bd4960ec8e29fa2cfab270b2d84b061e141be462"
      }
    ]
  }
}
