{
  "schemaVersion": 1,
  "generatedAt": "2026-02-17T19:14:36.402Z",
  "book": {
    "id": 236,
    "title": "The Jungle Book",
    "authors": [
      "Kipling, Rudyard"
    ],
    "characters": [
      "Mowgli",
      "Baloo",
      "Bagheera",
      "Shere Khan",
      "Akela",
      "Kaa",
      "Raksha"
    ],
    "keywords": [
      "India",
      "jungle",
      "wolves",
      "animals",
      "coming-of-age",
      "law of the jungle",
      "Kipling"
    ],
    "description": "A boy raised by wolves in the Indian jungle learns the ways of the wild from animal friends.",
    "languages": [],
    "subjects": [
      "Adventure stories, English",
      "Animals -- Fiction",
      "Feral children -- Fiction",
      "India -- Fiction",
      "India -- History -- 19th century -- Fiction",
      "Jungle animals -- Fiction",
      "Jungles -- Fiction",
      "Mowgli (Fictitious character) -- Fiction",
      "Short stories"
    ],
    "downloadCount": 10442,
    "updatedAt": 1762465432338,
    "links": {
      "txtUrl": null,
      "epubUrl": null,
      "coverUrl": null
    },
    "estimate": {
      "minutes": 368,
      "words": 58743,
      "wpm": 160,
      "source": "txt-head",
      "computedAt": 1762465351745
    },
    "source": {
      "kind": "gutenberg",
      "externalId": 236
    }
  },
  "local": {
    "layout": "by-title",
    "folderName": "The Jungle Book",
    "relativeDir": ".data/texts/by-title/The Jungle Book",
    "files": [
      {
        "role": "full",
        "filename": "full.txt",
        "bytes": 298958,
        "sha256": "a15ab7a56ecf803443ae6906c7ba61b0bc5204d32eab5b7362b63902047bd82f"
      },
      {
        "role": "bedtime",
        "filename": "bedtime.txt",
        "bytes": 4906,
        "sha256": "2a0c3e3376b8e9d8024838432db606254ca686ae5dc0bdda550b30598e77766b"
      },
      {
        "role": "other",
        "filename": "bedtime.pages.json",
        "bytes": 6908,
        "sha256": "1801b2f2f08dac044eca2ed81f1ba8af2d1b0b37d88191e03ff0ec75d1ca1df1"
      },
      {
        "role": "audio",
        "filename": "The_Jungle_Book.mp3",
        "bytes": 5346470,
        "sha256": "0a53c8f4e1b345617e9b282cc64a2a157f925278df21fe44848617a3aa888f74"
      },
      {
        "role": "image",
        "filename": "The_Jungle_Book.png",
        "bytes": 3146343,
        "sha256": "66d52da375aaf5589f78194772a9f8b86886b79ef6b49fd7d2db445a68c871a5"
      }
    ]
  }
}
