{
  "schemaVersion": 1,
  "generatedAt": "2026-02-17T19:14:36.356Z",
  "book": {
    "id": 99012,
    "title": "The Bell",
    "authors": [
      "Unknown"
    ],
    "characters": [
      "Prince",
      "Poor Boy"
    ],
    "keywords": [
      "Andersen",
      "mystery",
      "forest",
      "sound",
      "nature",
      "spiritual"
    ],
    "description": "Two boys search for the source of a mysterious bell that rings through the forest.",
    "languages": [
      "en"
    ],
    "subjects": [],
    "downloadCount": 0,
    "updatedAt": null,
    "links": {
      "txtUrl": null,
      "epubUrl": null,
      "coverUrl": null
    },
    "estimate": null,
    "source": {
      "kind": "local",
      "externalId": null
    }
  },
  "local": {
    "layout": "by-title",
    "folderName": "The Bell",
    "relativeDir": ".data/texts/by-title/The Bell",
    "files": [
      {
        "role": "full",
        "filename": "full.txt",
        "bytes": 2976,
        "sha256": "c1721c09c2a907cb9bfda16c9cfe46880eb12919248719c863f075a4375f566d"
      },
      {
        "role": "bedtime",
        "filename": "bedtime.txt",
        "bytes": 2214,
        "sha256": "f2305321ac1bf49c54a0b82b6afed656ded1581530798107912ea923799525ff"
      },
      {
        "role": "other",
        "filename": "bedtime.pages.json",
        "bytes": 3573,
        "sha256": "447d3810a1af2b6c12eb0d485895304d9424eb779c3b2e5dbd706a60725bb8cc"
      },
      {
        "role": "audio",
        "filename": "The_Bell.mp3",
        "bytes": 2373526,
        "sha256": "024f3e8e3d8bd09792768d263118711e0fe82226979d3b821435e85a07ba972c"
      },
      {
        "role": "image",
        "filename": "The_Bell.png",
        "bytes": 3136824,
        "sha256": "97e44649f78f8eb5cf1ac4024dbae4ceb02bfd44e0aaf6cd4ce450507677b18e"
      }
    ]
  }
}
