{
  "schemaVersion": 1,
  "generatedAt": "2026-01-18T20:35:59.063Z",
  "book": {
    "id": 99028,
    "title": "The Story of a Mother",
    "authors": [
      "Unknown"
    ],
    "characters": [
      "Mother",
      "Death",
      "Night",
      "Thorn Bush",
      "Lake"
    ],
    "keywords": [
      "Andersen",
      "grief",
      "sacrifice",
      "motherhood",
      "death",
      "tragedy"
    ],
    "description": "A mother makes desperate bargains to find Death and reclaim her child.",
    "languages": [
      "en"
    ],
    "subjects": [],
    "downloadCount": 0,
    "updatedAt": null,
    "links": {
      "txtUrl": null,
      "epubUrl": null,
      "coverUrl": null
    },
    "estimate": null,
    "source": {
      "kind": "local",
      "externalId": null
    }
  },
  "local": {
    "layout": "by-title",
    "folderName": "The Story of a Mother",
    "relativeDir": ".data/texts/by-title/The Story of a Mother",
    "files": [
      {
        "role": "full",
        "filename": "full.txt",
        "bytes": 4367,
        "sha256": "b2437c7b1e81d8adaa0189e607cdbb8791bd138432bb144897e3d7da5b4fc440"
      },
      {
        "role": "bedtime",
        "filename": "bedtime.txt",
        "bytes": 2763,
        "sha256": "39abea3fd2d700962977a71731cbf4760c9a1dcc0a2dc6922e11b1edf3c34748"
      }
    ]
  }
}
