{
  "schemaVersion": 1,
  "generatedAt": "2026-02-17T19:14:36.461Z",
  "book": {
    "id": 99026,
    "title": "The Shoes of Fortune",
    "authors": [
      "Unknown"
    ],
    "characters": [
      "Councillor",
      "Watchman",
      "Clerk",
      "Student"
    ],
    "keywords": [
      "Andersen",
      "magic shoes",
      "wishes",
      "transformation",
      "Copenhagen",
      "fantasy"
    ],
    "description": "Magical galoshes grant wishes to various people, often with unexpected results.",
    "languages": [
      "en"
    ],
    "subjects": [],
    "downloadCount": 0,
    "updatedAt": null,
    "links": {
      "txtUrl": null,
      "epubUrl": null,
      "coverUrl": null
    },
    "estimate": null,
    "source": {
      "kind": "local",
      "externalId": null
    }
  },
  "local": {
    "layout": "by-title",
    "folderName": "The Shoes of Fortune",
    "relativeDir": ".data/texts/by-title/The Shoes of Fortune",
    "files": [
      {
        "role": "full",
        "filename": "full.txt",
        "bytes": 4464,
        "sha256": "bb2360e8dc9a93183a1bc71e1342beaab8c860d8a488456497b4e670d36c7a8c"
      },
      {
        "role": "bedtime",
        "filename": "bedtime.txt",
        "bytes": 2977,
        "sha256": "684819749cc27495159333b093a65808a30c95483a71d636dde43424f63ef004"
      },
      {
        "role": "other",
        "filename": "bedtime.pages.json",
        "bytes": 4616,
        "sha256": "63fa0a2af3ece537fdd18e1218cc67bb57a2a8f4e6ac2ccc4713756801f7ac33"
      },
      {
        "role": "audio",
        "filename": "The_Shoes_of_Fortune.mp3",
        "bytes": 3329817,
        "sha256": "deb366565ba24d6914d64fe9a465371440918d5862c45b856051ca7dcc8f7073"
      },
      {
        "role": "image",
        "filename": "The_Shoes_of_Fortune.png",
        "bytes": 2936248,
        "sha256": "90833cd47764618d2dc771902e4ef10a60e322617411b75d7abe84edb3fa18c7"
      }
    ]
  }
}
