{
  "schemaVersion": 1,
  "generatedAt": "2026-02-17T19:14:36.325Z",
  "book": {
    "id": 99007,
    "title": "Rapunzel",
    "authors": [
      "Unknown"
    ],
    "characters": [
      "Rapunzel",
      "Witch",
      "Prince"
    ],
    "keywords": [
      "fairy tale",
      "tower",
      "long hair",
      "Grimm",
      "rescue",
      "magic",
      "enchantment"
    ],
    "description": "A girl with impossibly long hair is imprisoned in a tower by a witch until a prince discovers her.",
    "languages": [
      "en"
    ],
    "subjects": [],
    "downloadCount": 0,
    "updatedAt": null,
    "links": {
      "txtUrl": null,
      "epubUrl": null,
      "coverUrl": null
    },
    "estimate": null,
    "source": {
      "kind": "local",
      "externalId": null
    }
  },
  "local": {
    "layout": "by-title",
    "folderName": "Rapunzel",
    "relativeDir": ".data/texts/by-title/Rapunzel",
    "files": [
      {
        "role": "full",
        "filename": "full.txt",
        "bytes": 7470,
        "sha256": "e3a94bd0d156bc099b8c0ca8ac81e2dfb69875144f3d7c0eb2de1447220155c5"
      },
      {
        "role": "bedtime",
        "filename": "bedtime.txt",
        "bytes": 9442,
        "sha256": "b52dbea2fb3e4ac5711aed441c4cca7b894b8ecb725f137fa15121945b8d39c6"
      },
      {
        "role": "other",
        "filename": "bedtime.pages.json",
        "bytes": 5941,
        "sha256": "179387a306b7acd9de0201c36196610a183b0832152d7283bcb61210ebc1daea"
      },
      {
        "role": "audio",
        "filename": "Rapunzel.mp3",
        "bytes": 5045539,
        "sha256": "4a48504a1a8ccd58c2df41f4ec0f2fdf431e0bf287eb3e08f5d6fa054d8b5584"
      },
      {
        "role": "image",
        "filename": "Rapunzel.png",
        "bytes": 2859418,
        "sha256": "e2e678faec3a790752becbaf66a4ed9eb3fd324c4f2d1ad6149d4031b7ca999d"
      }
    ]
  }
}
