{
  "schemaVersion": 1,
  "generatedAt": "2026-01-18T20:35:59.084Z",
  "book": {
    "id": 99031,
    "title": "Tom Sawyer",
    "authors": [
      "Unknown"
    ],
    "characters": [
      "Tom Sawyer",
      "Huckleberry Finn",
      "Becky Thatcher",
      "Aunt Polly",
      "Injun Joe",
      "Joe Harper"
    ],
    "keywords": [
      "Mississippi",
      "adventure",
      "boyhood",
      "mischief",
      "Twain",
      "fence painting",
      "treasure",
      "cave"
    ],
    "description": "A mischievous boy has adventures along the Mississippi River with his friends.",
    "languages": [
      "en"
    ],
    "subjects": [],
    "downloadCount": 0,
    "updatedAt": null,
    "links": {
      "txtUrl": null,
      "epubUrl": null,
      "coverUrl": null
    },
    "estimate": null,
    "source": {
      "kind": "local",
      "externalId": null
    }
  },
  "local": {
    "layout": "by-title",
    "folderName": "Tom Sawyer",
    "relativeDir": ".data/texts/by-title/Tom Sawyer",
    "files": [
      {
        "role": "full",
        "filename": "full.txt",
        "bytes": 406477,
        "sha256": "7555f5e71be36ae9cfb5aaffdcd3772c5247b58ddbe4a1a123148409aa3781aa"
      }
    ]
  }
}
