{
  "schemaVersion": 1,
  "generatedAt": "2026-01-18T20:35:59.039Z",
  "book": {
    "id": 99021,
    "title": "The Naughty Boy",
    "authors": [
      "Unknown"
    ],
    "characters": [
      "Old Poet",
      "Cupid"
    ],
    "keywords": [
      "Andersen",
      "Cupid",
      "love",
      "arrow",
      "mischief",
      "heart"
    ],
    "description": "A mischievous boy with a bow and arrow visits an old poet on a stormy night.",
    "languages": [
      "en"
    ],
    "subjects": [],
    "downloadCount": 0,
    "updatedAt": null,
    "links": {
      "txtUrl": null,
      "epubUrl": null,
      "coverUrl": null
    },
    "estimate": null,
    "source": {
      "kind": "local",
      "externalId": null
    }
  },
  "local": {
    "layout": "by-title",
    "folderName": "The Naughty Boy",
    "relativeDir": ".data/texts/by-title/The Naughty Boy",
    "files": [
      {
        "role": "full",
        "filename": "full.txt",
        "bytes": 2979,
        "sha256": "75c049865f351c0af194be39b0c5d21a9361860e167f842e4631c1d851ec898b"
      },
      {
        "role": "bedtime",
        "filename": "bedtime.txt",
        "bytes": 1889,
        "sha256": "5e5f6c5cec93a01428a87bb281e2c7e0fab26a78135e3bebb4bc3e40925a13fa"
      },
      {
        "role": "audio",
        "filename": "The_Naughty_Boy.mp3",
        "bytes": 1933415,
        "sha256": "000662611cbd5c3f2e1c3c5dcb0cbcec91314c4f177246ffc6d148a8a84e18df"
      },
      {
        "role": "image",
        "filename": "The_Naughty_Boy.png",
        "bytes": 2845447,
        "sha256": "14c6f51de7d9c63b1c3733958977627af681417daaa8386c465c797f7864038f"
      }
    ]
  }
}
