{
  "schemaVersion": 1,
  "generatedAt": "2026-01-18T20:35:58.982Z",
  "book": {
    "id": 99018,
    "title": "The Happy Family",
    "authors": [
      "Unknown"
    ],
    "characters": [
      "Snails",
      "Old Snail Couple"
    ],
    "keywords": [
      "Andersen",
      "contentment",
      "family",
      "burdock",
      "simple life",
      "nature"
    ],
    "description": "A family of snails lives contentedly in a burdock forest, finding happiness in simple things.",
    "languages": [
      "en"
    ],
    "subjects": [],
    "downloadCount": 0,
    "updatedAt": null,
    "links": {
      "txtUrl": null,
      "epubUrl": null,
      "coverUrl": null
    },
    "estimate": null,
    "source": {
      "kind": "local",
      "externalId": null
    }
  },
  "local": {
    "layout": "by-title",
    "folderName": "The Happy Family",
    "relativeDir": ".data/texts/by-title/The Happy Family",
    "files": [
      {
        "role": "full",
        "filename": "full.txt",
        "bytes": 3459,
        "sha256": "486a8beb7938c5ef0d410004aef0ddb86365b481cb880173ea62464ba1e437ae"
      },
      {
        "role": "bedtime",
        "filename": "bedtime.txt",
        "bytes": 2416,
        "sha256": "b5d67e85657cf388d56bad7a0f8172757e3599e5da0308615a5a48e5b71fe7e2"
      },
      {
        "role": "audio",
        "filename": "The_Happy_Family.mp3",
        "bytes": 2386901,
        "sha256": "1b7080abfd157c3c5a3ac9f58329c91e2976ece477d6e7507c80b26b06f3fdbe"
      },
      {
        "role": "image",
        "filename": "The_Happy_Family.png",
        "bytes": 2919477,
        "sha256": "b22e107160fd9db24071f52eb990ab4fae628f5c454c46b38a72e7f7f95a9579"
      }
    ]
  }
}
