{
  "schemaVersion": 1,
  "generatedAt": "2026-02-17T19:14:36.251Z",
  "book": {
    "id": 45,
    "title": "Anne of Green Gables",
    "authors": [
      "Montgomery, L. M. (Lucy Maud)"
    ],
    "characters": [
      "Anne Shirley",
      "Matthew Cuthbert",
      "Marilla Cuthbert",
      "Diana Barry",
      "Gilbert Blythe",
      "Rachel Lynde"
    ],
    "keywords": [
      "orphan",
      "adoption",
      "friendship",
      "imagination",
      "Prince Edward Island",
      "coming-of-age",
      "red hair",
      "kindred spirits"
    ],
    "description": "An imaginative orphan girl is mistakenly sent to a farm on Prince Edward Island, where she wins the hearts of her reluctant caretakers.",
    "languages": [],
    "subjects": [
      "Bildungsromans",
      "Canada -- History -- 1867-1914 -- Fiction",
      "Country life -- Prince Edward Island -- Fiction",
      "Friendship -- Fiction",
      "Girls -- Fiction",
      "Islands -- Fiction",
      "Orphans -- Fiction",
      "Prince Edward Island -- History -- 20th century -- Fiction",
      "Shirley, Anne (Fictitious character) -- Fiction"
    ],
    "downloadCount": 24731,
    "updatedAt": 1762465432338,
    "links": {
      "txtUrl": null,
      "epubUrl": null,
      "coverUrl": null
    },
    "estimate": {
      "minutes": 739,
      "words": 118165,
      "wpm": 160,
      "source": "txt-head",
      "computedAt": 1762465349358
    },
    "source": {
      "kind": "gutenberg",
      "externalId": 45
    }
  },
  "local": {
    "layout": "by-title",
    "folderName": "Anne of Green Gables",
    "relativeDir": ".data/texts/by-title/Anne of Green Gables",
    "files": [
      {
        "role": "full",
        "filename": "full.txt",
        "bytes": 595833,
        "sha256": "cf0b0da6e3a68d2588ee47463b8b279915bc9d907a3b39c9edbcb66f3d7912c7"
      },
      {
        "role": "bedtime",
        "filename": "bedtime.txt",
        "bytes": 3877,
        "sha256": "5f61015b0f1be8496af36414bd400462e447eac697242070de4adb88b587fc8e"
      },
      {
        "role": "audio",
        "filename": "Anne_of_Green_Gables.mp3",
        "bytes": 4002731,
        "sha256": "50904dd68611a8e2419a2f0621e7a6e75a0cea5bda1fbc9044ee974d830024be"
      },
      {
        "role": "image",
        "filename": "Anne_of_Green_Gables.png",
        "bytes": 2984373,
        "sha256": "79ace401fec5837c338ad78b000ef799c41670fce05a1d63c491dac95753154a"
      },
      {
        "role": "other",
        "filename": "bedtime.pages.json",
        "bytes": 5246,
        "sha256": "d6e5cd3f4c8a4a02693f85328c2ba4f0c115f44bca275e4434ffcbd4e19b4b5e"
      }
    ]
  }
}
