{
  "schemaVersion": 1,
  "generatedAt": "2026-02-17T19:14:36.232Z",
  "book": {
    "id": 11,
    "title": "Alice's Adventures in Wonderland",
    "authors": [
      "Carroll, Lewis"
    ],
    "characters": [
      "Alice",
      "White Rabbit",
      "Cheshire Cat",
      "Queen of Hearts",
      "Mad Hatter",
      "March Hare",
      "Caterpillar",
      "King of Hearts",
      "Duchess"
    ],
    "keywords": [
      "fantasy",
      "nonsense",
      "Victorian",
      "dream",
      "curiosity",
      "absurd",
      "playing cards",
      "tea party",
      "rabbit hole",
      "wonderland"
    ],
    "description": "A young girl named Alice falls down a rabbit hole into a fantastical underground world populated by peculiar creatures.",
    "languages": [],
    "subjects": [
      "Alice (Fictitious character from Carroll) -- Juvenile fiction",
      "Children's stories",
      "Fantasy fiction",
      "Imaginary places -- Juvenile fiction"
    ],
    "downloadCount": 65142,
    "updatedAt": 1762465432338,
    "links": {
      "txtUrl": null,
      "epubUrl": null,
      "coverUrl": null
    },
    "estimate": {
      "minutes": 209,
      "words": 33384,
      "wpm": 160,
      "source": "txt-head",
      "computedAt": 1762465347627
    },
    "source": {
      "kind": "gutenberg",
      "externalId": 11
    }
  },
  "local": {
    "layout": "by-title",
    "folderName": "Alice’s Adventures in Wonderland",
    "relativeDir": ".data/texts/by-title/Alice’s Adventures in Wonderland",
    "files": [
      {
        "role": "full",
        "filename": "full.txt",
        "bytes": 151559,
        "sha256": "312361a0d404b606bb1402c3d023f39854c82a9a2c68e878acf976be4ef7e9cb"
      },
      {
        "role": "bedtime",
        "filename": "bedtime.txt",
        "bytes": 4777,
        "sha256": "89b708ece93476a1fe6f2cc4a967e16a062557c644ec245fce8bf195de29b871"
      },
      {
        "role": "audio",
        "filename": "Alice's_Adventures_in_Wonderland.mp3",
        "bytes": 4935198,
        "sha256": "c442ec4915a6284ebe0e1809a39a44867680e8c4a55bf5c61b8011ec5e6444a0"
      },
      {
        "role": "image",
        "filename": "Alice's_Adventures_in_Wonderland.png",
        "bytes": 3220282,
        "sha256": "b999c740e8246075aec979cfff27f59dc004246f18229b572d7898ebf012def2"
      },
      {
        "role": "other",
        "filename": "bedtime.pages.json",
        "bytes": 6758,
        "sha256": "7fd95a95d9cb31d3f54ce86fe4a0e36a375e72d8b977bab041705215b9ccb420"
      },
      {
        "role": "other",
        "filename": "bedtime.story.json",
        "bytes": 9720,
        "sha256": "f082b8a0caf7b017cf4c8d13e769e91f6772b2f1e26a619678a9b7abcd426943"
      },
      {
        "role": "other",
        "filename": "full.story.json",
        "bytes": 197454,
        "sha256": "b97f2299d6954080b3b6ab920d213b0b8aa54bd53a302d96dd982bfc2afb8a22"
      }
    ]
  }
}
