{
  "schemaVersion": 1,
  "generatedAt": "2026-02-17T19:14:36.437Z",
  "book": {
    "id": 113,
    "title": "The Secret Garden",
    "authors": [
      "Burnett, Frances Hodgson"
    ],
    "characters": [
      "Mary Lennox",
      "Colin Craven",
      "Dickon",
      "Ben Weatherstaff",
      "Martha",
      "Archibald Craven"
    ],
    "keywords": [
      "garden",
      "healing",
      "friendship",
      "Yorkshire",
      "orphan",
      "nature",
      "transformation",
      "manor"
    ],
    "description": "An orphaned girl discovers a hidden garden that transforms her and those around her.",
    "languages": [],
    "subjects": [
      "Gardens -- Juvenile fiction",
      "Orphans -- Juvenile fiction",
      "People with disabilities -- Juvenile fiction",
      "Yorkshire (England) -- Juvenile fiction"
    ],
    "downloadCount": 5866,
    "updatedAt": 1762465432339,
    "links": {
      "txtUrl": null,
      "epubUrl": null,
      "coverUrl": null
    },
    "estimate": {
      "minutes": 554,
      "words": 88544,
      "wpm": 160,
      "source": "txt-head",
      "computedAt": 1762465354155
    },
    "source": {
      "kind": "gutenberg",
      "externalId": 113
    }
  },
  "local": {
    "layout": "by-title",
    "folderName": "The Secret Garden",
    "relativeDir": ".data/texts/by-title/The Secret Garden",
    "files": [
      {
        "role": "full",
        "filename": "full.txt",
        "bytes": 455087,
        "sha256": "c7a065710fe2873dcc6a07d60095950f6c97f247e15189c13d815b862fce2fb5"
      },
      {
        "role": "bedtime",
        "filename": "bedtime.txt",
        "bytes": 5027,
        "sha256": "8cabc088e36d01a0285f85adfef74bd0eea10590e8c64dbd4ed0c647d486d038"
      },
      {
        "role": "other",
        "filename": "bedtime.pages.json",
        "bytes": 6365,
        "sha256": "2b01666b06c5dfc63d64947dcf1b7e6fdf6bc2546f7daf1649010cdbaa8cabb7"
      },
      {
        "role": "audio",
        "filename": "The_Secret_Garden.mp3",
        "bytes": 5590140,
        "sha256": "e23d62736bf35ba992cc1ac6959778cb4b1ccb7e46f69b3048e37450177ed8d6"
      },
      {
        "role": "image",
        "filename": "The_Secret_Garden.png",
        "bytes": 2770642,
        "sha256": "562ae5c5c0491f2ed0cb747516504f45536c126c147ace2586143641967671f4"
      }
    ]
  }
}
