{
  "schemaVersion": 1,
  "generatedAt": "2026-01-18T20:35:58.919Z",
  "book": {
    "id": 99014,
    "title": "The Elderbush",
    "authors": [
      "Unknown"
    ],
    "characters": [
      "Little Boy",
      "Old Man",
      "Elder-Tree Mother"
    ],
    "keywords": [
      "Andersen",
      "memories",
      "nature",
      "elderflower",
      "storytelling",
      "Denmark"
    ],
    "description": "An old man shares memories and stories with a sick boy under the elder tree.",
    "languages": [
      "en"
    ],
    "subjects": [],
    "downloadCount": 0,
    "updatedAt": null,
    "links": {
      "txtUrl": null,
      "epubUrl": null,
      "coverUrl": null
    },
    "estimate": null,
    "source": {
      "kind": "local",
      "externalId": null
    }
  },
  "local": {
    "layout": "by-title",
    "folderName": "The Elderbush",
    "relativeDir": ".data/texts/by-title/The Elderbush",
    "files": [
      {
        "role": "full",
        "filename": "full.txt",
        "bytes": 16589,
        "sha256": "e2f079d5ec7b9e704da9a50f74fd5f4c48378ec08cb6fc9db3089c9aedac9ef3"
      },
      {
        "role": "bedtime",
        "filename": "bedtime.txt",
        "bytes": 2305,
        "sha256": "b42ce8804bbdeda5f7882ab29d5bd1d234f2453fcede1a0aa38204bf3438f8e5"
      },
      {
        "role": "audio",
        "filename": "The_Elderbush.mp3",
        "bytes": 2488047,
        "sha256": "ea4f30adae720da44c309c3badb866feb57e89cdbefd52f824659ce3439cd9e2"
      },
      {
        "role": "image",
        "filename": "The_Elderbush.png",
        "bytes": 2657063,
        "sha256": "4b195ee94618b4bdd4811ca908ff918a42df199b2c7618c9648e4330a408edb3"
      }
    ]
  }
}
