{
  "schemaVersion": 1,
  "generatedAt": "2026-02-17T19:14:36.495Z",
  "book": {
    "id": 55,
    "title": "The Wonderful Wizard of Oz",
    "authors": [
      "Baum, L. Frank (Lyman Frank)"
    ],
    "characters": [
      "Dorothy",
      "Toto",
      "Scarecrow",
      "Tin Woodman",
      "Cowardly Lion",
      "Wizard of Oz",
      "Wicked Witch",
      "Glinda"
    ],
    "keywords": [
      "Kansas",
      "tornado",
      "yellow brick road",
      "Emerald City",
      "magic",
      "home",
      "ruby slippers",
      "Baum"
    ],
    "description": "A Kansas girl and her dog are swept by tornado to a magical land where they seek a wizard's help to return home.",
    "languages": [],
    "subjects": [
      "Courage -- Juvenile fiction",
      "Cowardly Lion (Fictitious character) -- Juvenile fiction",
      "Cyclones -- Juvenile fiction",
      "Dreams -- Juvenile fiction",
      "Fantasy literature",
      "Gale, Dorothy (Fictitious character) -- Juvenile fiction",
      "Good and evil -- Juvenile fiction",
      "Home -- Juvenile fiction",
      "Oz (Imaginary place) -- Juvenile fiction",
      "Scarecrow (Fictitious character from Baum) -- Juvenile fiction",
      "Tin Woodman (Fictitious character) -- Juvenile fiction",
      "Toto (Fictitious character) -- Juvenile fiction",
      "Witches -- Juvenile fiction",
      "Wizard of Oz (Fictitious character) -- Juvenile fiction"
    ],
    "downloadCount": 17901,
    "updatedAt": 1762465432338,
    "links": {
      "txtUrl": null,
      "epubUrl": null,
      "coverUrl": null
    },
    "estimate": {
      "minutes": 286,
      "words": 45722,
      "wpm": 160,
      "source": "txt-head",
      "computedAt": 1762465349692
    },
    "source": {
      "kind": "gutenberg",
      "externalId": 55
    }
  },
  "local": {
    "layout": "by-title",
    "folderName": "The Wonderful Wizard of Oz",
    "relativeDir": ".data/texts/by-title/The Wonderful Wizard of Oz",
    "files": [
      {
        "role": "full",
        "filename": "full.txt",
        "bytes": 212677,
        "sha256": "236607227520e1158f25b836bbcfe898aab4a536bcd5b4628141ef1ae8024fdc"
      },
      {
        "role": "bedtime",
        "filename": "bedtime.txt",
        "bytes": 5366,
        "sha256": "c3f4053e2e182a37cf1788b6eea6d9ae44a4fbeacb00d8ca808484b970708e54"
      },
      {
        "role": "other",
        "filename": "bedtime.pages.json",
        "bytes": 7175,
        "sha256": "93ef92c3efb037f7595b6093b21c066f003f7f0fc1e5bc5c7a57684d73595745"
      },
      {
        "role": "audio",
        "filename": "The_Wonderful_Wizard_of_Oz.mp3",
        "bytes": 5785327,
        "sha256": "8cacaf67aff3ff771156c71252aa184855779bd84100430654f6111115578015"
      },
      {
        "role": "image",
        "filename": "The_Wonderful_Wizard_of_Oz.png",
        "bytes": 3092541,
        "sha256": "b48f4712cf972828ab37ecec50ed7ae16cf74fecff934c2178a0cc7f54eada76"
      }
    ]
  }
}
