{
  "schemaVersion": 1,
  "generatedAt": "2026-01-18T20:35:58.947Z",
  "book": {
    "id": 99016,
    "title": "The False Collar",
    "authors": [
      "Unknown"
    ],
    "characters": [
      "Collar",
      "Garter",
      "Iron",
      "Scissors"
    ],
    "keywords": [
      "Andersen",
      "vanity",
      "pride",
      "objects",
      "humor",
      "boasting"
    ],
    "description": "A proud shirt collar boasts of his adventures and romantic conquests.",
    "languages": [
      "en"
    ],
    "subjects": [],
    "downloadCount": 0,
    "updatedAt": null,
    "links": {
      "txtUrl": null,
      "epubUrl": null,
      "coverUrl": null
    },
    "estimate": null,
    "source": {
      "kind": "local",
      "externalId": null
    }
  },
  "local": {
    "layout": "by-title",
    "folderName": "The False Collar",
    "relativeDir": ".data/texts/by-title/The False Collar",
    "files": [
      {
        "role": "full",
        "filename": "full.txt",
        "bytes": 2907,
        "sha256": "4046ea2d8d7b79f96bc9aae39e84f15fe54f5b89f36b1a62ccbcab8db29d92bc"
      },
      {
        "role": "bedtime",
        "filename": "bedtime.txt",
        "bytes": 2003,
        "sha256": "d4ceee02e899731e41c3fa679de496e476898ecfc763aaef90bee98a6885dfb2"
      },
      {
        "role": "audio",
        "filename": "The_False_Collar.mp3",
        "bytes": 2190460,
        "sha256": "1a9a831707ff53d1a760968bb1f4ab5ff6b333613a812fa6d5699efdde9d53c2"
      },
      {
        "role": "image",
        "filename": "The_False_Collar.png",
        "bytes": 3098800,
        "sha256": "2c7d427fe1cb546794ba71f419eaf487a70d572f49bd43d878447aaf815adbbf"
      }
    ]
  }
}
