{
  "schemaVersion": 1,
  "generatedAt": "2026-01-18T20:35:59.043Z",
  "book": {
    "id": 99023,
    "title": "The Real Princess",
    "authors": [
      "Unknown"
    ],
    "characters": [
      "Princess",
      "Prince",
      "Queen"
    ],
    "keywords": [
      "Andersen",
      "Princess and the Pea",
      "sensitivity",
      "test",
      "royalty",
      "mattresses"
    ],
    "description": "A queen devises a test with a pea under many mattresses to prove a girl is a true princess.",
    "languages": [
      "en"
    ],
    "subjects": [],
    "downloadCount": 0,
    "updatedAt": null,
    "links": {
      "txtUrl": null,
      "epubUrl": null,
      "coverUrl": null
    },
    "estimate": null,
    "source": {
      "kind": "local",
      "externalId": null
    }
  },
  "local": {
    "layout": "by-title",
    "folderName": "The Real Princess",
    "relativeDir": ".data/texts/by-title/The Real Princess",
    "files": [
      {
        "role": "full",
        "filename": "full.txt",
        "bytes": 3128,
        "sha256": "d0c010696b189e5dee9c24809a887bb3e0eac7ad5c16fa3f0cf5ab85e37b96a1"
      },
      {
        "role": "bedtime",
        "filename": "bedtime.txt",
        "bytes": 2270,
        "sha256": "68fde418b39a05e061330b3a60a3cbe1a81a654a7480afde58f7e01ad3568d97"
      }
    ]
  }
}
