{
  "schemaVersion": 1,
  "generatedAt": "2026-02-17T19:14:36.306Z",
  "book": {
    "id": 99006,
    "title": "Hansel & Gretel",
    "authors": [
      "Unknown"
    ],
    "characters": [
      "Hansel",
      "Gretel",
      "Witch",
      "Father",
      "Stepmother"
    ],
    "keywords": [
      "fairy tale",
      "forest",
      "gingerbread house",
      "witch",
      "siblings",
      "Grimm",
      "breadcrumbs",
      "oven"
    ],
    "description": "Two siblings lost in the forest discover a house made of sweets, owned by a wicked witch.",
    "languages": [
      "en"
    ],
    "subjects": [],
    "downloadCount": 0,
    "updatedAt": null,
    "links": {
      "txtUrl": null,
      "epubUrl": null,
      "coverUrl": null
    },
    "estimate": null,
    "source": {
      "kind": "local",
      "externalId": null
    }
  },
  "local": {
    "layout": "by-title",
    "folderName": "Hansel & Gretel",
    "relativeDir": ".data/texts/by-title/Hansel & Gretel",
    "files": [
      {
        "role": "full",
        "filename": "full.txt",
        "bytes": 15991,
        "sha256": "36f6c92fd359aea827a89e0827e7a3f41dd0635b1a4b802493fd6d16fcbf009b"
      },
      {
        "role": "bedtime",
        "filename": "bedtime.txt",
        "bytes": 4211,
        "sha256": "dab5095237c1ba89538b4a1e87fc27becf5278eaa80d19d1b44d4b3c3ec6d5ba"
      },
      {
        "role": "other",
        "filename": "bedtime.pages.json",
        "bytes": 6040,
        "sha256": "162c8b415319e67f15ef95dccfc9ab9ce2ac3bf93d3d349b9afbcadbae22c3e2"
      },
      {
        "role": "image",
        "filename": "Hansel & Gretel.png",
        "bytes": 2644325,
        "sha256": "c4e8d508d31828c6aea1d4ca03e4662b3dad91dbf66f4e01b5a727ff873bcd83"
      },
      {
        "role": "audio",
        "filename": "Hansel_and_Gretel.mp3",
        "bytes": 4597905,
        "sha256": "b6a42a17da91169c5135d641bda4ec9b79b2a644ef77a3023235aa2cacd654d0"
      }
    ]
  }
}
